{
  "document_id": "doc_mock_001",
  "language": "ru",
  "status": "success",
  "source": {
    "id": "source_mock_rd_001",
    "title": "Анонимизированный R&D корпус: гидрометаллургия и экология",
    "filename": "mock_rd_corpus.pdf",
    "source_type": "internal_report",
    "access_level": "internal",
    "year": 2024,
    "country": "RU",
    "organization": "Demo R&D Lab",
    "authors": [
      "Иванов И.И.",
      "Petrov P."
    ]
  },
  "chunks": [
    {
      "id": "chunk_desalination_001",
      "page": 12,
      "text": "Для воды обогатительной фабрики с содержанием сульфатов и хлоридов 200-300 мг/л, Ca, Mg, Na 200-300 мг/л и требованием по сухому остатку не более 1000 мг/дм3 применимы обратный осмос, электродиализ и ионный обмен. Обратный осмос требует предварительной фильтрации.",
      "embedding_text": "water desalination sulfates chlorides calcium magnesium sodium dry residue reverse osmosis electrodialysis ion exchange concentrating plant"
    },
    {
      "id": "chunk_catholyte_001",
      "page": 8,
      "text": "В мировой практике электроэкстракции никеля описаны продольная, поперечная и распределительная схема циркуляции католита. Для промышленных ванн скорость потока католита 0.2-0.5 м/с указана как рабочий диапазон, обеспечивающий устойчивое качество катода.",
      "embedding_text": "nickel electrowinning catholyte circulation longitudinal transverse distributor flow velocity 0.2 0.5 m/s"
    },
    {
      "id": "chunk_matte_slag_001",
      "page": 21,
      "text": "Эксперименты 2021-2025 годов по распределению Au, Ag и МПГ между медным и никелевым штейном и шлаком показывают зависимость коэффициента распределения от температуры 1250-1350 °C и состава шлака.",
      "embedding_text": "gold silver platinum group metals matte slag distribution copper matte nickel matte experiments 2021 2025 temperature 1250 1350"
    },
    {
      "id": "chunk_mine_water_001",
      "page": 33,
      "text": "Закачка шахтных вод в глубокие горизонты применяется в России и за рубежом. Для пилотных проектов производительность 100-500 м3/ч, CAPEX 120-350 млн руб., OPEX 25-80 руб./м3. Ограничение: требуется гидрогеологическое обоснование и мониторинг пластового давления.",
      "embedding_text": "mine water deep injection Russia foreign CAPEX OPEX hydrogeology deep aquifers productivity"
    },
    {
      "id": "chunk_experts_001",
      "page": 45,
      "text": "Лаборатория гидрометаллургии обладает экспертизой по электроэкстракции никеля и циркуляции электролита. Лаборатория экологии работала с шахтными водами и технологиями водоподготовки.",
      "embedding_text": "experts laboratory hydrometallurgy ecology nickel electrowinning mine water desalination"
    }
  ],
  "entities": [
    {
      "id": "ent_process_desalination",
      "type": "Process",
      "name": "обессоливание воды",
      "canonical_name": "water desalination",
      "language": "ru",
      "aliases": [
        "desalination",
        "водоподготовка"
      ],
      "source_chunk_id": "chunk_desalination_001",
      "page": 12,
      "confidence": 0.96
    },
    {
      "id": "ent_reverse_osmosis",
      "type": "TechnologySolution",
      "name": "обратный осмос",
      "canonical_name": "reverse osmosis",
      "language": "ru",
      "aliases": [
        "RO"
      ],
      "source_chunk_id": "chunk_desalination_001",
      "page": 12,
      "confidence": 0.95
    },
    {
      "id": "ent_electrodialysis",
      "type": "TechnologySolution",
      "name": "электродиализ",
      "canonical_name": "electrodialysis",
      "language": "ru",
      "aliases": [
        "ED"
      ],
      "source_chunk_id": "chunk_desalination_001",
      "page": 12,
      "confidence": 0.92
    },
    {
      "id": "ent_ion_exchange",
      "type": "TechnologySolution",
      "name": "ионный обмен",
      "canonical_name": "ion exchange",
      "language": "ru",
      "aliases": [
        "ion-exchange"
      ],
      "source_chunk_id": "chunk_desalination_001",
      "page": 12,
      "confidence": 0.91
    },
    {
      "id": "ent_sulfates",
      "type": "Material",
      "name": "сульфаты",
      "canonical_name": "sulfates",
      "language": "ru",
      "aliases": [
        "SO4",
        "sulfate"
      ],
      "source_chunk_id": "chunk_desalination_001",
      "page": 12,
      "confidence": 0.98
    },
    {
      "id": "ent_chlorides",
      "type": "Material",
      "name": "хлориды",
      "canonical_name": "chlorides",
      "language": "ru",
      "aliases": [
        "Cl",
        "chloride"
      ],
      "source_chunk_id": "chunk_desalination_001",
      "page": 12,
      "confidence": 0.98
    },
    {
      "id": "ent_calcium",
      "type": "Material",
      "name": "Ca",
      "canonical_name": "calcium",
      "language": "ru",
      "aliases": [
        "кальций",
        "Ca2+"
      ],
      "source_chunk_id": "chunk_desalination_001",
      "page": 12,
      "confidence": 0.96
    },
    {
      "id": "ent_magnesium",
      "type": "Material",
      "name": "Mg",
      "canonical_name": "magnesium",
      "language": "ru",
      "aliases": [
        "магний",
        "Mg2+"
      ],
      "source_chunk_id": "chunk_desalination_001",
      "page": 12,
      "confidence": 0.96
    },
    {
      "id": "ent_sodium",
      "type": "Material",
      "name": "Na",
      "canonical_name": "sodium",
      "language": "ru",
      "aliases": [
        "натрий",
        "Na+"
      ],
      "source_chunk_id": "chunk_desalination_001",
      "page": 12,
      "confidence": 0.96
    },
    {
      "id": "ent_process_nickel_ew",
      "type": "Process",
      "name": "электроэкстракция никеля",
      "canonical_name": "nickel electrowinning",
      "language": "ru",
      "aliases": [
        "electrowinning",
        "электролитическое извлечение никеля"
      ],
      "source_chunk_id": "chunk_catholyte_001",
      "page": 8,
      "confidence": 0.97
    },
    {
      "id": "ent_catholyte",
      "type": "Material",
      "name": "католит",
      "canonical_name": "catholyte",
      "language": "ru",
      "aliases": [
        "catholyte",
        "катодный электролит"
      ],
      "source_chunk_id": "chunk_catholyte_001",
      "page": 8,
      "confidence": 0.97
    },
    {
      "id": "ent_ew_cell",
      "type": "Equipment",
      "name": "ванна электроэкстракции",
      "canonical_name": "electrowinning cell",
      "language": "ru",
      "aliases": [
        "electrowinning bath"
      ],
      "source_chunk_id": "chunk_catholyte_001",
      "page": 8,
      "confidence": 0.9
    },
    {
      "id": "ent_longitudinal_circulation",
      "type": "TechnologySolution",
      "name": "продольная циркуляция",
      "canonical_name": "longitudinal catholyte circulation",
      "language": "ru",
      "aliases": [],
      "source_chunk_id": "chunk_catholyte_001",
      "page": 8,
      "confidence": 0.88
    },
    {
      "id": "ent_transverse_circulation",
      "type": "TechnologySolution",
      "name": "поперечная циркуляция",
      "canonical_name": "transverse catholyte circulation",
      "language": "ru",
      "aliases": [],
      "source_chunk_id": "chunk_catholyte_001",
      "page": 8,
      "confidence": 0.87
    },
    {
      "id": "ent_distributor_circulation",
      "type": "TechnologySolution",
      "name": "распределительная схема циркуляции",
      "canonical_name": "distributed catholyte circulation",
      "language": "ru",
      "aliases": [],
      "source_chunk_id": "chunk_catholyte_001",
      "page": 8,
      "confidence": 0.86
    },
    {
      "id": "ent_process_matte_slag",
      "type": "Process",
      "name": "распределение между штейном и шлаком",
      "canonical_name": "matte slag distribution",
      "language": "ru",
      "aliases": [
        "matte-slag partitioning"
      ],
      "source_chunk_id": "chunk_matte_slag_001",
      "page": 21,
      "confidence": 0.95
    },
    {
      "id": "ent_gold",
      "type": "Material",
      "name": "Au",
      "canonical_name": "gold",
      "language": "ru",
      "aliases": [
        "золото"
      ],
      "source_chunk_id": "chunk_matte_slag_001",
      "page": 21,
      "confidence": 0.98
    },
    {
      "id": "ent_silver",
      "type": "Material",
      "name": "Ag",
      "canonical_name": "silver",
      "language": "ru",
      "aliases": [
        "серебро"
      ],
      "source_chunk_id": "chunk_matte_slag_001",
      "page": 21,
      "confidence": 0.98
    },
    {
      "id": "ent_pgm",
      "type": "Material",
      "name": "МПГ",
      "canonical_name": "platinum group metals",
      "language": "ru",
      "aliases": [
        "PGM",
        "platinum group metals"
      ],
      "source_chunk_id": "chunk_matte_slag_001",
      "page": 21,
      "confidence": 0.96
    },
    {
      "id": "ent_copper_matte",
      "type": "Material",
      "name": "медный штейн",
      "canonical_name": "copper matte",
      "language": "ru",
      "aliases": [],
      "source_chunk_id": "chunk_matte_slag_001",
      "page": 21,
      "confidence": 0.93
    },
    {
      "id": "ent_nickel_matte",
      "type": "Material",
      "name": "никелевый штейн",
      "canonical_name": "nickel matte",
      "language": "ru",
      "aliases": [],
      "source_chunk_id": "chunk_matte_slag_001",
      "page": 21,
      "confidence": 0.93
    },
    {
      "id": "ent_slag",
      "type": "Material",
      "name": "шлак",
      "canonical_name": "slag",
      "language": "ru",
      "aliases": [
        "slag phase"
      ],
      "source_chunk_id": "chunk_matte_slag_001",
      "page": 21,
      "confidence": 0.92
    },
    {
      "id": "ent_process_mine_water_injection",
      "type": "Process",
      "name": "закачка шахтных вод в глубокие горизонты",
      "canonical_name": "mine water deep injection",
      "language": "ru",
      "aliases": [
        "deep well injection",
        "закачка в глубокие горизонты"
      ],